一,[yī] one; 1; single; a (article); as soon as; entire; whole; all; throughout; "one" radical in Chinese characters (Kangxi radical 1); also pr. [yao1] for greater clarity when spelling out numbers digit by digit; 
齐,[Qí] (name of states and dynasties at several different periods); surname Qi; [qí] neat; even; level with; identical; simultaneous; all together; to even sth out; 
门,[Mén] surname Men; [mén] gate; door; CL:扇[shan4]; gateway; doorway; CL:個|个[ge4]; opening; valve; switch; way to do something; knack; family; house; (religious) sect; school (of thought); class; category; phylum or division (taxonomy); classifier for large guns; classifier for lessons, subjects, branches of technology; (suffix) -gate (i.e. scandal; derived from Watergate); 
错,[Cuò] surname Cuo; [cuò] mistake; wrong; bad; interlocking; complex; to grind; to polish; to alternate; to stagger; to miss; to let slip; to evade; to inlay with gold or silver; 
丑,[Chǒu] surname Chou; [chǒu] clown; 2nd earthly branch: 1-3 a.m., 12th solar month (6th January to 3rd February), year of the Ox; [chǒu] shameful; ugly; disgraceful; 
个,[gè] individual; this; that; size; classifier for people or objects in general; [gè] variant of 個|个[ge4]; 
么,[má] exclamatory final particle; [ma] interrogative final particle; [me] suffix, used to form interrogative 甚麼|什么[shen2 me5], what?, indefinite 這麼|这么[zhe4 me5] thus, etc; [me] variant of 麼|么[me5]; 
也,[Yě] surname Ye; [yě] also; too; (in Classical Chinese) final particle implying affirmation; 
了,[le] (modal particle intensifying preceding clause); (completed action marker); [liǎo] to finish; to achieve; to understand; 
享,[xiǎng] to enjoy; to benefit; to have the use of; 
亲,[qīn] parent; one's own (flesh and blood); relative; related; marriage; bride; close; intimate; in person; first-hand; in favor of; pro-; to kiss; [qìng] parents-in-law of one's offspring; 
,
什,[shén] what; [shí] ten (used in fractions, writing checks etc); assorted; miscellaneous; 
量,[liáng] to measure; [liàng] capacity; quantity; amount; to estimate; abbr. for 量詞|量词[liang4 ci2], classifier (in Chinese grammar); measure word; 
仔,[zǎi] variant of 崽[zai3]; [zī] see 仔肩[zi1 jian1]; [zǐ] meticulous; (of domestic animals or fowls) young; 
部,[bù] ministry; department; section; part; division; troops; board; classifier for works of literature, films, machines etc; 
他,[tā] he or him; (used for either sex when the sex is unknown or unimportant); (used before sb's name for emphasis); (used as a meaningless mock object); other; another; 
那,[Nā] surname Na; [Nuó] surname Nuo; [nǎ] variant of 哪[na3]; [nà] that; those; then (in that case); commonly pr. [nei4] before a classifier, esp. in Beijing; [nuó] (archaic) many; beautiful; how; old variant of 挪[nuo2]; 
以,[Yǐ] abbr. for Israel 以色列[Yi3 se4 lie4]; [yǐ] to use; according to; so as to; by means of; in order to; by; with; because; 
道,[dào] direction; way; road; path; CL:條|条[tiao2],股[gu3]; principle; truth; morality; reason; skill; method; Dao (of Daoism); to say; to speak; to talk; classifier for long thin things (rivers, cracks etc), barriers (walls, doors etc), questions (in an exam etc), commands, courses in a meal, steps in a process; province (of Korea or Japan); 
通,[tōng] to go through; to know well; (suffix) expert; to connect; to communicate; open; to clear; classifier for letters, telegrams, phone calls etc; [tòng] classifier for an activity, taken in its entirety (tirade of abuse, stint of music playing, bout of drinking etc); 
们,[men] plural marker for pronouns, and nouns referring to individuals; 
似,[sì] to seem; to appear; to resemble; similar; -like; pseudo-; (more) than; 
迫,[pò] to force; to compel; to approach or go towards; urgent; pressing; 
你,[nǐ] you (informal, as opposed to courteous 您[nin2]); 
侯,[Hóu] surname Hou; [hóu] marquis, second of the five orders of ancient Chinese nobility 五等爵位[wu3 deng3 jue2 wei4]; nobleman or high official; 
信,[xìn] letter; mail; CL:封[feng1]; to trust; to believe; to profess faith in; truthful; confidence; trust; at will; at random; 
候,[hòu] to wait; to inquire after; to watch; season; climate; (old) period of five days; 
催,[cuī] to urge; to press; to prompt; to rush sb; to hasten sth; to expedite; 
像,[xiàng] to resemble; to be like; to look as if; such as; appearance; image; portrait; image under a mapping (math.); 
儿,[ér] son; [r] non-syllabic diminutive suffix; retroflex final; 
其,[qí] his; her; its; their; that; such; it (refers to sth preceding it); 
进,[jìn] to advance; to enter; to come (or go) into; to receive or admit; to eat or drink; to submit or present; (used after a verb) into, in; to score a goal; 
几,[jī] small table; [jī] almost; [jǐ] how much; how many; several; a few; 
这,[zhè] this; these; (commonly pr. [zhei4] before a classifier, esp. in Beijing); 
出,[chū] to go out; to come out; to occur; to produce; to go beyond; to rise; to put forth; to happen; classifier for dramas, plays, operas etc; 
分,[fēn] to divide; to separate; to distribute; to allocate; to distinguish (good and bad); part or subdivision; fraction; one tenth (of certain units); unit of length equivalent to 0.33 cm; minute; a point (in sports or games); 0.01 yuan (unit of money); [fèn] part; share; ingredient; component; 
还,[Huán] surname Huan; [hái] still; still in progress; still more; yet; even more; in addition; fairly; passably (good); as early as; even; also; else; [huán] to pay back; to return; 
列,[liè] to arrange; to line up; row; file; series; column; 
刚,[gāng] hard; firm; strong; just; barely; exactly; 
前,[qián] front; forward; ahead; first; top (followed by a number); future; ago; before; BC (e.g. 前293年); former; formerly; 
半,[bàn] half; semi-; incomplete; (after a number) and a half; 
过,[Guò] surname Guo; [guò] (experienced action marker); to cross; to go over; to pass (time); to celebrate (a holiday); to live; to get along; excessively; too-; 
厉,[Lì] surname Li; [lì] strict; severe; 
身,[shēn] body; life; oneself; personally; one's morality and conduct; the main part of a structure or body; pregnant; classifier for sets of clothes: suit, twinset; Kangxi radical 158; 
去,[qù] to go; to go to (a place); to cause to go or send (sb); to remove; to get rid of; (when used either before or after a verb) to go in order to do sth; to be apart from in space or time; (after a verb of motion indicates movement away from the speaker); (used after certain verbs to indicate detachment or separation); (of a time or an event etc) just passed or elapsed; 
及,[jí] and; to reach; up to; in time for; 
友,[yǒu] friend; 
可,[kě] can; may; able to; to approve; to permit; to suit; (particle used for emphasis) certainly; very; [kè] see 可汗[ke4 han2]; 
号,[háo] roar; cry; CL:個|个[ge4]; [hào] ordinal number; day of a month; mark; sign; business establishment; size; ship suffix; horn (wind instrument); bugle call; assumed name; to take a pulse; classifier used to indicate number of people; 
跳,[tiào] to jump; to hop; to skip over; to bounce; to palpitate; 
同,[tóng] like; same; similar; together; alike; with; 
跑,[páo] (of an animal) to paw (the ground); [pǎo] to run; to run away; to escape; to run around (on errands etc); (of a gas or liquid) to leak or evaporate; (verb complement) away; off; 
后,[Hòu] surname Hou; [hòu] empress; queen; [hòu] back; behind; rear; afterwards; after; later; 
向,[Xiàng] surname Xiang; [xiàng] towards; to face; to turn towards; direction; to support; to side with; shortly before; formerly; always; all along; 
吗,[mǎ] see 嗎啡|吗啡, morphine; [ma] (question particle for "yes-no" questions); 
听,[yǐn] smile (archaic); [tīng] to listen; to hear; to obey; a can (loanword from English "tin"); classifier for canned beverages; [tìng] (literary pronunciation, still advocated in Taiwan) to rule; to sentence; to allow; 
呀,[ya] (particle equivalent to 啊 after a vowel, expressing surprise or doubt); 
告,[gào] to tell; to inform; to say; 
起,[qǐ] to rise; to raise; to get up; to set out; to start; to appear; to launch; to initiate (action); to draft; to establish; to get (from a depot or counter); verb suffix, to start; (before place or time) starting from; classifier for occurrences or unpredictable events: case, instance; classifier for groups: batch, group; 
呢,[ne] particle indicating that a previously asked question is to be applied to the preceding word ("What about ...?", "And ...?"); particle for inquiring about location ("Where is ...?"); particle signaling a pause, to emphasize the preceding words and allow the listener time to take them on board ("ok?", "are you with me?"); (at the end of a declarative sentence) particle indicating continuation of a state or action; particle indicating strong affirmation; [ní] woolen material; 
味,[wèi] taste; smell; classifier for drugs (in TCM); 
咱,[zá] see 咱[zan2]; [zán] I or me; we (including both the speaker and the person spoken to); 
谁,[shéi] who; also pr. [shui2]; 
啊,[ā] interjection of surprise; Ah!; Oh!; [á] interjection expressing doubt or requiring answer; Eh?; what?; to show realization; to stress; [ǎ] interjection of surprise or doubt; Eh?; My!; what's up?; [à] interjection or grunt of agreement; uhm; Ah, OK; expression of recognition; Oh, it's you!; [a] modal particle ending sentence, showing affirmation, approval, or consent; 
啦,[lā] (onom.) sound of singing, cheering etc; (phonetic); (dialect) to chat; [la] sentence-final particle, contraction of 了啊, indicating exclamation; particle placed after each item in a list of examples; 
喜,[xǐ] to be fond of; to like; to enjoy; to be happy; to feel pleased; happiness; delight; glad; 
说,[shuì] to persuade; [shuō] to speak; to say; to explain; to scold; to tell off; a theory (usually in compounds such as 日心说 heliocentric theory); 
嘛,[ma] modal particle indicating that sth is obvious; particle indicating a pause for emphasis; 
在,[zài] (located) at; (to be) in; to exist; in the middle of doing sth; (indicating an action in progress); 
天,[tiān] day; sky; heaven; 
她,[tā] she; 
好,[hǎo] good; well; proper; good to; easy to; very; so; (suffix indicating completion or readiness); (of an unmarried couple) to be close; to be keen on each other; [hào] to be fond of; to have a tendency to; to be prone to; 
该,[gāi] should; ought to; probably; must be; to deserve; to owe; to be sb's turn to do sth; that; the above-mentioned; 
婴,[yīng] infant; baby; 
话,[huà] dialect; language; spoken words; speech; talk; words; conversation; what sb said; CL:種|种[zhong3],席[xi2],句[ju4],口[kou3],番[fan1]; [huà] old variant of 話|话[hua4]; 
,
安,[An1] surname An; [ān] content; calm; still; quiet; safe; secure; in good health; to find a place for; to install; to fix; to fit; to bring (a charge against sb); to pacify; security; safety; peace; ampere; 
实,[shí] real; true; honest; really; solid; fruit; seed; definitely; 
害,[hài] to do harm to; to cause trouble to; harm; evil; calamity; 
家,[Jiā] surname Jia; [jiā] home; family; (polite) my (sister, uncle etc); classifier for families or businesses; refers to the philosophical schools of pre-Han China; noun suffix for a specialist in some activity, such as a musician or revolutionary, corresponding to English -ist, -er, -ary or -ian; CL:個|个[ge4]; 
诉,[sù] to complain; to sue; to tell; 
对,[duì] right; correct; couple; pair; towards; at; for; to face; opposite; to treat (sb a certain way); to match together; to adjust; to fit; to suit; to answer; to reply; classifier: couple; 
小,[xiǎo] small; tiny; few; young; 
讲,[jiǎng] to speak; to explain; to negotiate; to emphasise; to be particular about; as far as sth is concerned; speech; lecture; 
尝,[cháng] to taste; to try; already; ever; once; [cháng] to taste; [cháng] old variant of 嘗|尝[chang2]; 
就,[jiù] at once; right away; only; just (emphasis); as early as; already; as soon as; then; in that case; as many as; even if; to approach; to move towards; to undertake; to engage in; to suffer; subjected to; to accomplish; to take advantage of; to go with (of foods); with regard to; concerning; 
师,[Shī] surname Shi; [shī] teacher; master; expert; model; army division; (old) troops; to dispatch troops; 
干,[gān] old variant of 乾|干[gan1]; [Gān] surname Gan; [gān] dry; clean; in vain; dried food; foster; adoptive; to ignore; [gān] variant of 乾|干[gan1]; [gān] to concern; to interfere; shield; stem; [gàn] tree trunk; main part of sth; to manage; to work; to do; capable; cadre; to kill (slang); to fuck (vulgar); 
记,[jì] to record; to note; to remember; mark; sign; classifier for blows, kicks, shots; 
年,[Nián] surname Nian; [nián] year; CL:個|个[ge4]; 
待,[dāi] to stay; [dài] to wait; to treat; to deal with; to need; going to (do sth); about to; intending to; 
得,[dé] to obtain; to get; to gain; to catch (a disease); proper; suitable; proud; contented; to allow; to permit; ready; finished; [de] structural particle: used after a verb (or adjective as main verb), linking it to following phrase indicating effect, degree, possibility etc; [děi] to have to; must; ought to; to need to; 
心,[xīn] heart; mind; intention; center; core; CL:顆|颗[ke1],個|个[ge4]; 
让,[ràng] to yield; to permit; to let sb do sth; to have sb do sth; to make sb (feel sad etc); 
忆,[yì] to recollect; to remember; memory; 
快,[kuài] rapid; quick; speed; rate; soon; almost; to make haste; clever; sharp (of knives or wits); forthright; plain-spoken; gratified; pleased; pleasant; 
不,[bù] (negative prefix); not; no; 
悦,[yuè] pleased; 
想,[xiǎng] to think; to believe; to suppose; to wish; to want; to miss (feel wistful about the absence of sb or sth); 
见,[jiàn] to see; to meet; to appear (to be sth); to interview; [xiàn] to appear; also written 現|现[xian4]; 
愣,[lèng] to look distracted; to stare blankly; distracted; blank; (coll.) unexpectedly; rash; rashly; 
我,[wǒ] I; me; my; 
打,[dá] dozen (loanword); [dǎ] to beat; to strike; to hit; to break; to type; to mix up; to build; to fight; to fetch; to make; to tie up; to issue; to shoot; to calculate; to play (a game); since; from; 
要,[yāo] to demand; to request; to coerce; [yào] important; vital; to want; to ask for; will; going to (as future auxiliary); may; must; (used in a comparison) must be; probably; if; 
色,[sè] color; CL:種|种[zhong3]; look; appearance; sex; [shǎi] color; dice; 
老,[lǎo] prefix used before the surname of a person or a numeral indicating the order of birth of the children in a family or to indicate affection or familiarity; old (of people); venerable (person); experienced; of long standing; always; all the time; of the past; very; outdated; (of meat etc) tough; 
拿,[ná] to hold; to seize; to catch; to apprehend; to take; (used in the same way as 把[ba3]: to mark the following noun as a direct object); 
绿,[lù:] green; 
排,[pái] a row; a line; to set in order; to arrange; to line up; to eliminate; to drain; to push open; platoon; raft; classifier for lines, rows etc; 
给,[gěi] to; for; for the benefit of; to give; to allow; to do sth (for sb); (passive particle); [jǐ] to supply; to provide; 
整,[zhěng] exactly; in good order; whole; complete; entire; in order; orderly; to repair; to mend; to renovate; (coll.) to fix sb; to give sb a hard time; to mess with sb; 
细,[xì] thin or slender; finely particulate; thin and soft; fine; delicate; trifling; (of a sound) quiet; frugal; 
新,[Xīn] abbr. for Xinjiang 新疆[Xin1 jiang1] or Singapore 新加坡[Xin1 jia1 po1]; surname Xin; [xīn] new; newly; meso- (chemistry); 
早,[zǎo] early; morning; Good morning!; long ago; prematurely; 
第,[dì] (prefix indicating ordinal number, e.g. first, number two etc); 
时,[shí] old variant of 時|时[shi2]; [Shí] surname Shi; [shí] o'clock; time; when; hour; season; period; 
码,[mǎ] weight; number; code; to pile; to stack; classifier for length or distance (yard), happenings etc; 
是,[shì] is; are; am; yes; to be; 
更,[gēng] to change or replace; to experience; one of the five two hour periods into which the night was formerly divided; watch (e.g. of a sentry or guard); [gèng] more; even more; further; still; still more; 
朋,[péng] friend; 
本,[běn] roots or stems of plants; origin; source; this; the current; root; foundation; basis; classifier for books, periodicals, files etc; originally; 
机,[Jī] surname Ji; [jī] machine; engine; opportunity; intention; aircraft; pivot; crucial point; flexible (quick-witted); organic; CL:臺|台[tai2]; 
知,[zhī] to know; to be aware; 
李,[Lǐ] surname Li; [lǐ] plum; 
来,[lái] to come; to arrive; to come round; ever since; next; 
根,[gēn] root; basis; classifier for long slender objects, e.g. cigarettes, guitar strings; CL:條|条[tiao2]; radical (chemistry); 
着,[zhāo] (chess) move; trick; all right!; (dialect) to add; [zháo] to touch; to come in contact with; to feel; to be affected by; to catch fire; to fall asleep; to burn; [zhe] aspect particle indicating action in progress; [zhuó] to wear (clothes); to contact; to use; to apply; 
次,[cì] next in sequence; second; the second (day, time etc); secondary; vice-; sub-; infra-; inferior quality; substandard; order; sequence; hypo- (chemistry); classifier for enumerated events: time; 
没,[méi] (negative prefix for verbs); have not; not; [mò] drowned; to end; to die; to inundate; 
涵,[hán] to contain; to include; culvert; 
滋,[zī] to grow; to nourish; to increase; to cause; juice; taste; (dialect) to spout; to spurt; 
真,[zhēn] really; truly; indeed; real; true; genuine; 
点,[diǎn] point; dot; drop; speck; o'clock; point (in space or time); to draw a dot; to check on a list; to choose; to order (food in a restaurant); to touch briefly; to hint; to light; to ignite; to pour a liquid drop by drop; (old) one fifth of a two-hour watch 更[geng1]; dot stroke in Chinese characters; classifier for items; 
燃,[rán] to burn; to ignite; to light; fig. to spark off (hopes); to start (debate); to raise (hopes); 
爸,[bà] father; dad; pa; papa; 
看,[kān] to look after; to take care of; to watch; to guard; [kàn] to see; to look at; to read; to watch; to visit; to call on; to consider; to regard as; to look after; to treat (an illness); to depend on; to feel (that); (after verb) to give it a try; Watch out! (for a danger); 
犹,[yóu] as if; (just) like; just as; still; yet; 
王,[Wáng] surname Wang; [wáng] king or monarch; best or strongest of its type; grand; great; [wàng] to rule; to reign over; 
玩,[wán] toy; sth used for amusement; curio or antique (Taiwan pr. [wan4]); to play; to have fun; to trifle with; to keep sth for entertainment; 
现,[xiàn] to appear; present; now; existing; current; 
盯,[dīng] to watch attentively; to fix one's attention on; to stare at; to gaze at; 
电,[diàn] electric; electricity; electrical; 
的,[de] of; ~'s (possessive particle); (used after an attribute); (used to form a nominal expression); (used at the end of a declarative sentence for emphasis); [dī] see 的士[di1 shi4]; [dí] really and truly; [dì] aim; clear; 
婴儿,[yīng ér] infant; baby; CL:個|个[ge4]; lead (Pb); 
电话,[diàn huà] telephone; CL:部[bu4]; phone call; CL:通[tong1]; phone number; 
爸爸,[bà ba] (informal) father; CL:個|个[ge4],位[wei4]; 
滋味,[zī wèi] taste; flavor; feeling; 
真是,[zhēn shi] indeed; truly; (coll.) (used to express disapproval, annoyance etc about sth); 
根本,[gēn běn] fundamental; basic; root; simply; absolutely (not); (not) at all; CL:個|个[ge4]; 
机身,[jī shēn] body of a vehicle or machine; fuselage of a plane; 
知道,[zhī dào] to know; to become aware of; also pr. [zhi1 dao5]; 
时候,[shí hou] time; length of time; moment; period; 
早就,[zǎo jiù] already at an earlier time; 
不是,[bú shi] fault; blame; [bù shì] no; is not; not; 
整齐,[zhěng qí] orderly; neat; even; tidy; 
排列,[pái liè] array; arrangement; permutation (i.e. ordered choice of n elements out of m); 
拿起,[ná qǐ] to pick up; 
绿色,[lù: sè] green; 
打错,[dǎ cuò] to err; to dial a wrong number; to make a typo; 
老师,[lǎo shī] teacher; CL:個|个[ge4],位[wei4]; 
打量,[dǎ liang] to size sb up; to take measure of; to suppose; to reckon; 
不过,[bù guò] only; merely; no more than; but; however; anyway (to get back to a previous topic); 
什么,[shén me] what?; who?; something; anything; 
心跳,[xīn tiào] heartbeat; pulse; 
干嘛,[gàn má] what are you doing?; whatever for?; why on earth?; 
仔细,[zǐ xì] careful; attentive; cautious; 
那个,[nà ge] that one; also pr. [nei4 ge5]; 
家门,[jiā mén] house door; family clan; 
现在,[xiàn zài] now; at present; at the moment; modern; current; nowadays; 
他们,[tā men] they; 
喜悦,[xǐ yuè] happy; joyous; 
咱们,[zá men] see 咱們|咱们[zan2 men5]; [zán men] we or us (including both the speaker and the person(s) spoken to); I or me; you; 
告诉,[gào su] to tell; to inform; to let know; 
,
号码,[hào mǎ] number; CL:堆[dui1],個|个[ge4]; 
厉害,[lì hai] difficult to deal with; difficult to endure; ferocious; radical; serious; terrible; violent; tremendous; awesome; 
半天,[bàn tiān] half of the day; a long time; quite a while; midair; CL:個|个[ge4]; 
分享,[fēn xiǎng] to share (joys, benefits, privileges etc) with others; to get one's share; to divide out; to partake; 
还是,[hái shi] or; still; nevertheless; had better; 
几年,[jǐ nián] a few years; several years; how many years; 
其实,[qí shí] actually; in fact; really; 
进门,[jìn mén] to enter a door; to go in; to learn the basics of a subject; to join one's husband's household upon marriage; 
似的,[shì de] seems as if; rather like; Taiwan pr. [si4 de5]; 
以前,[yǐ qián] before; formerly; previous; ago; 
以后,[yǐ hòu] after; later; afterwards; following; later on; in the future; 
快点,[kuài diǎn] to do sth more quickly; Hurry up!; Get a move on!; 
好朋友,[hǎo péng you] good friend; (slang) a visit from Aunt Flo (menstrual period); 
小朋友,[xiǎo péng yǒu] child; CL:個|个[ge4]; 
想起来,[xiǎng qi lai] to remember; to recall; 
打电话,[dǎ diàn huà] to make a telephone call; 
第一次,[dì yī cì] the first time; first; number one; 
迫不及待,[pò bù jí dài] impatient (idiom); in a hurry; itching to get on with it; 
记忆犹新,[jì yì yóu xīn] to remain fresh in one's memory (idiom); 
亲朋好友,[qīn péng hǎo yǒu] friends and family; kith and kin; 
