小,[xiǎo] small; tiny; few; young; 
一,[yī] one; 1; single; a (article); as soon as; entire; whole; all; throughout; "one" radical in Chinese characters (Kangxi radical 1); also pr. [yao1] for greater clarity when spelling out numbers digit by digit; 
不,[bù] (negative prefix); not; no; 
业,[Yè] surname Ye; [yè] line of business; industry; occupation; job; employment; school studies; enterprise; property; (Buddhism) karma; deed; to engage in; already; 
乐,[Lè] surname Le; [Yuè] surname Yue; [lè] happy; cheerful; to laugh; [yuè] music; 
也,[Yě] surname Ye; [yě] also; too; (in Classical Chinese) final particle implying affirmation; 
了,[le] (modal particle intensifying preceding clause); (completed action marker); [liǎo] to finish; to achieve; to understand; 
互,[hù] mutual; 
鞋,[xié] shoe; CL:雙|双[shuang1],隻|只[zhi1]; 
井,[Jǐng] Jing, one of the 28 constellations of Chinese astronomy; surname Jing; [jǐng] a well; CL:口[kou3]; neat; orderly; 
今,[jīn] today; modern; present; current; this; now; 
都,[Dū] surname Du; [dōu] all; both; entirely; (used for emphasis) even; already; (not) at all; [dū] capital city; metropolis; 
他,[tā] he or him; (used for either sex when the sex is unknown or unimportant); (used before sb's name for emphasis); (used as a meaningless mock object); other; another; 
们,[men] plural marker for pronouns, and nouns referring to individuals; 
作,[zuò] to do; to grow; to write or compose; to pretend; to regard as; to feel; writings or works; 
连,[Lián] surname Lian; [lián] to link; to join; to connect; continuously; in succession; including; (used with 也, 都 etc) even; company (military); 
你,[nǐ] you (informal, as opposed to courteous 您[nin2]); 
倒,[dǎo] to fall; to collapse; to topple; to fail; to go bankrupt; to change (trains or buses); to move around; to sell; to speculate (buying and selling, also 搗|捣); profiteer; [dào] to place upside down; to invert; to pour; to throw out; to move backwards; however; actually; as a matter of fact; contrary to expectation; 
候,[hòu] to wait; to inquire after; to watch; season; climate; (old) period of five days; 
做,[zuò] to do; to make; to produce; to write; to compose; to act as; to engage in; to hold (a party); to be; to become; to function (in some capacity); to serve as; to be used for; to form (a bond or relationship); to pretend; to feign; to act a part; to put on appearance; 
写,[xiě] to write; 
冰,[bīng] ice; CL:塊|块[kuai4]; methamphetamine (slang); 
到,[dào] to (a place); until (a time); up to; to go; to arrive; (verb complement denoting completion or result of an action); 
过,[Guò] surname Guo; [guò] (experienced action marker); to cross; to go over; to pass (time); to celebrate (a holiday); to live; to get along; excessively; too-; 
助,[zhù] to help; to assist; 
去,[qù] to go; to go to (a place); to cause to go or send (sb); to remove; to get rid of; (when used either before or after a verb) to go in order to do sth; to be apart from in space or time; (after a verb of motion indicates movement away from the speaker); (used after certain verbs to indicate detachment or separation); (of a time or an event etc) just passed or elapsed; 
吃,[chī] to eat; to consume; to eat at (a cafeteria etc); to eradicate; to destroy; to absorb; to suffer; to stammer (Taiwan pr. for this sense is [ji2]); 
后,[Hòu] surname Hou; [hòu] empress; queen; [hòu] back; behind; rear; afterwards; after; later; 
周,[Zhōu] surname Zhou; Zhou Dynasty (1046-256 BC); [zhōu] to make a circuit; to circle; circle; circumference; lap; cycle; complete; all; all over; thorough; to help financially; 
啊,[ā] interjection of surprise; Ah!; Oh!; [á] interjection expressing doubt or requiring answer; Eh?; what?; to show realization; to stress; [ǎ] interjection of surprise or doubt; Eh?; My!; what's up?; [à] interjection or grunt of agreement; uhm; Ah, OK; expression of recognition; Oh, it's you!; [a] modal particle ending sentence, showing affirmation, approval, or consent; 
场,[cháng] threshing floor; classifier for events and happenings: spell, episode, bout; [chǎng] large place used for a specific purpose; stage; scene (of a play); classifier for sporting or recreational activities; classifier for number of exams; [cháng] variant of 場|场[chang2]; [chǎng] variant of 場|场[chang3]; 
声,[shēng] sound; voice; tone; noise; classifier for sounds; 
天,[tiān] day; sky; heaven; 
好,[hǎo] good; well; proper; good to; easy to; very; so; (suffix indicating completion or readiness); (of an unmarried couple) to be close; to be keen on each other; [hào] to be fond of; to have a tendency to; to be prone to; 
起,[qǐ] to rise; to raise; to get up; to set out; to start; to appear; to launch; to initiate (action); to draft; to establish; to get (from a depot or counter); verb suffix, to start; (before place or time) starting from; classifier for occurrences or unpredictable events: case, instance; classifier for groups: batch, group; 
妈,[mā] ma; mom; mother; 
谢,[Xiè] surname Xie; [xiè] to thank; to apologize; to wither (of flowers, leaves etc); to decline; 
始,[shǐ] to begin; to start; then; only then; 
寒,[hán] cold; poor; to tremble; 
对,[duì] right; correct; couple; pair; towards; at; for; to face; opposite; to treat (sb a certain way); to match together; to adjust; to fit; to suit; to answer; to reply; classifier: couple; 
上,[shǎng] see 上聲|上声[shang3 sheng1]; [shàng] on top; upon; above; upper; previous; first (of multiple parts); to climb; to get onto; to go up; to attend (class or university); 
说,[shuì] to persuade; [shuō] to speak; to say; to explain; to scold; to tell off; a theory (usually in compounds such as 日心说 heliocentric theory); 
带,[dài] band; belt; girdle; ribbon; tire; area; zone; region; CL:條|条[tiao2]; to wear; to carry; to take along; to bear (i.e. to have); to lead; to bring; to look after; to raise; 
帮,[bāng] old variant of 幫|帮[bang1]; [bāng] old variant of 幫|帮[bang1]; [bāng] to help; to assist; to support; for sb (i.e. as a help); hired (as worker); side (of pail, boat etc); outer layer; group; gang; clique; party; secret society; 
穿,[chuān] to bore through; to pierce; to perforate; to penetrate; to pass through; to dress; to wear; to put on; to thread; 
开,[kāi] to open; to start; to turn on; to boil; to write out (a prescription, check, invoice etc); to operate (vehicle); abbr. for 開爾文|开尔文 degrees Kelvin; 
真,[zhēn] really; truly; indeed; real; true; genuine; 
心,[xīn] heart; mind; intention; center; core; CL:顆|颗[ke1],個|个[ge4]; 
快,[kuài] rapid; quick; speed; rate; soon; almost; to make haste; clever; sharp (of knives or wits); forthright; plain-spoken; gratified; pleased; pleasant; 
相,[Xiāng] surname Xiang; [xiāng] each other; one another; mutually; [xiàng] appearance; portrait; picture; government minister; (physics) phase; 
我,[wǒ] I; me; my; 
的,[de] of; ~'s (possessive particle); (used after an attribute); (used to form a nominal expression); (used at the end of a declarative sentence for emphasis); [dī] see 的士[di1 shi4]; [dí] really and truly; [dì] aim; clear; 
扶,[fú] to support with the hand; to help sb up; to support oneself by holding onto something; to help; 
把,[bǎ] to hold; to contain; to grasp; to take hold of; handle; particle marking the following noun as a direct object; classifier for objects with handle; classifier for small objects: handful; [bà] handle; 
摔,[shuāi] to throw down; to fall; to drop and break; 
溜,[liū] to slip away; to escape in stealth; to skate; 
早,[zǎo] early; morning; Good morning!; long ago; prematurely; 
来,[lái] to come; to arrive; to come round; ever since; next; 
时,[shí] old variant of 時|时[shi2]; [Shí] surname Shi; [shí] o'clock; time; when; hour; season; period; 
饭,[fàn] food; cuisine; cooked rice; meal; CL:碗[wan3],頓|顿[dun4]; 
早饭,[zǎo fàn] breakfast; CL:份[fen4],頓|顿[dun4],次[ci4],餐[can1]; 
早上,[zǎo shang] early morning; CL:個|个[ge4]; 
摔倒,[shuāi dǎo] to fall down; to slip and fall; a throw (in wrestling); 
溜冰,[liū bīng] ice skating; 
互相,[hù xiāng] each other; mutually; mutual; 
今天,[jīn tiān] today; at the present; now; 
我们,[wǒ men] we; us; ourselves; our; 
快乐,[kuài lè] happy; merry; 
开始,[kāi shǐ] to begin; beginning; to start; initial; CL:個|个[ge4]; 
帮助,[bāng zhù] assistance; aid; to help; to assist; 
时候,[shí hou] time; length of time; moment; period; 
妈妈,[mā ma] mama; mommy; mother; CL:個|个[ge4],位[wei4]; 
谢谢,[xiè xie] to thank; thanks; thank you; 
,
起来,[qǐ lai] to stand up; to get up; [qi lai] (after a verb) indicating the beginning and continuation of an action or a state; indicating an upward movement (e.g. after 站[zhan4]); bringing things together (e.g. after 收拾[shou1 shi5]); (after a perception verb, e.g. 看[kan4]) expressing preliminary judgement; 
到了,[dào liǎo] at last; finally; in the end; 
作业,[zuò yè] school assignment; homework; work; task; operation; CL:個|个[ge4]; to operate; 
连声,[lián shēng] repeatedly (say something); 
小心,[xiǎo xīn] to be careful; to take care; 
溜冰鞋,[liū bīng xié] skating shoes; ice skates; roller skates; roller blades; 
溜冰场,[liū bīng chǎng] ice rink; skating rink; 
