断,[duàn] to break; to snap; to cut off; to give up or abstain from sth; to judge; (usu. used in the negative) absolutely; definitely; decidedly; 
上,[shǎng] see 上聲|上声[shang3 sheng1]; [shàng] on top; upon; above; upper; previous; first (of multiple parts); to climb; to get onto; to go up; to attend (class or university); 
不,[bù] (negative prefix); not; no; 
业,[Yè] surname Ye; [yè] line of business; industry; occupation; job; employment; school studies; enterprise; property; (Buddhism) karma; deed; to engage in; already; 
高,[Gāo] surname Gao; [gāo] high; tall; above average; loud; your (honorific); 
两,[liǎng] two; both; some; a few; tael, unit of weight equal to 50 grams (modern) or 1⁄16 of a catty 斤[jin1] (old); 
个,[gè] individual; this; that; size; classifier for people or objects in general; [gè] variant of 個|个[ge4]; 
为,[wéi] as (in the capacity of); to take sth as; to act as; to serve as; to behave as; to become; to be; to do; by (in the passive voice); [wèi] because of; for; to; [wéi] variant of 為|为[wei2]; as (i.e. in the capacity of); to take sth as; to act as; to serve as; to behave as; to become; to be; to do; [wèi] variant of 為|为[wei4], because of; for; to; 
之,[zhī] (possessive particle, literary equivalent of 的[de5]); him; her; it; 
首,[shǒu] head; chief; first (occasion, thing etc); classifier for poems, songs etc; 
京,[Jīng] abbr. for Beijing; surname Jing; Jing ethnic minority; [jīng] capital city of a country; big; algebraic term for a large number (old); artificial mound (old); 
今,[jīn] today; modern; present; current; this; now; 
需,[xū] to require; to need; to want; necessity; need; 
付,[Fù] surname Fu; [fù] to pay; to hand over to; 
会,[huì] can; to be possible; to be able to; will; to be likely to; to be sure to; to assemble; to meet; to gather; to see; union; group; association; CL:個|个[ge4]; a moment (Taiwan pr. for this sense is [hui3]); [kuài] to balance an account; accountancy; accounting; 
保,[Bǎo] Bulgaria; Bulgarian; abbr. for 保加利亞|保加利亚[Bao3 jia1 li4 ya4]; [bǎo] to defend; to protect; to keep; to guarantee; to ensure; 
集,[jí] to gather; to collect; collected works; classifier for sections of a TV series etc: episode; 
全,[Quán] surname Quan; [quán] all; whole; entire; every; complete; 
闻,[Wén] surname Wen; [wén] to hear; news; well-known; famous; reputation; fame; to smell; to sniff at; 
刷,[shuā] to brush; to paint; to daub; to paste up; to skip class (of students); to fire from a job; [shuà] to select; 
间,[jiān] between; among; within a definite time or space; room; section of a room or lateral space between two pairs of pillars; classifier for rooms; [jiàn] gap; to separate; to thin out (seedlings); to sow discontent; 
务,[wù] affair; business; matter; 
北,[běi] north; to be defeated (classical); 
银,[yín] silver; silver-colored; relating to money or currency; 
南,[Nán] surname Nan; [nán] south; 
铁,[Tiě] surname Tie; [tiě] iron (metal); arms; weapons; hard; strong; violent; unshakeable; determined; close; tight (slang); 
卡,[kǎ] to stop; to block; card; CL:張|张[zhang1],片[pian4]; calorie; cassette; (computing) (coll.) slow; [qiǎ] to block; to be stuck; to be wedged; customs station; a clip; a fastener; a checkpost; Taiwan pr. [ka3]; 
发,[fā] to send out; to show (one's feeling); to issue; to develop; classifier for gunshots (rounds); [fà] hair; Taiwan pr. [fa3]; 
口,[kǒu] mouth; classifier for things with mouths (people, domestic animals, cannons, wells etc); classifier for bites or mouthfuls; 
召,[Shào] surname Shao; name of an ancient state that existed in what is now Shaanxi Province; [zhào] to call together; to summon; to convene; temple or monastery (used in place names in Inner Mongolia); 
都,[Dū] surname Du; [dōu] all; both; entirely; (used for emphasis) even; already; (not) at all; [dū] capital city; metropolis; 
启,[Qǐ] Qi son of Yu the Great 禹[Yu3], reported founder of the Xia Dynasty 夏朝[Xia4 Chao2] (c. 2070-c. 1600 BC); [qǐ] to open; to start; to initiate; to enlighten or awaken; to state; to inform; 
和,[Hé] surname He; Japanese (food, clothes etc); [hé] and; together with; with; sum; union; peace; harmony; Taiwan pr. [han4] when it means "and"; [hè] to compose a poem in reply (to sb's poem) using the same rhyme sequence; to join in the singing; to chime in with others; [hú] to complete a set in mahjong or playing cards; [huó] soft; warm; [huò] to mix together; to blend; 
售,[shòu] to sell; to make or carry out (a plan or intrigue etc); 
部,[bù] ministry; department; section; part; division; troops; board; classifier for works of literature, films, machines etc; 
团,[tuán] round; lump; ball; to roll into a ball; to gather; regiment; group; society; [tuán] dumpling; 
在,[zài] (located) at; (to be) in; to exist; in the middle of doing sth; (indicating an action in progress); 
场,[cháng] threshing floor; classifier for events and happenings: spell, episode, bout; [chǎng] large place used for a specific purpose; stage; scene (of a play); classifier for sporting or recreational activities; classifier for number of exams; [cháng] variant of 場|场[chang2]; [chǎng] variant of 場|场[chang3]; 
处,[chǔ] to reside; to live; to dwell; to be in; to be situated at; to stay; to get along with; to be in a position of; to deal with; to discipline; to punish; [chù] place; location; spot; point; office; department; bureau; respect; classifier for locations or items of damage: spot, point; 
大,[dà] big; huge; large; major; great; wide; deep; older (than); oldest; eldest; greatly; very much; (dialect) father; father's elder or younger brother; [dài] see 大夫[dai4 fu5]; 
安,[An1] surname An; [ān] content; calm; still; quiet; safe; secure; in good health; to find a place for; to install; to fix; to fit; to bring (a charge against sb); to pacify; security; safety; peace; ampere; 
实,[shí] real; true; honest; really; solid; fruit; seed; definitely; 
郑,[Zhèng] Zheng state during the Warring States period; surname Zheng; abbr. for 鄭州|郑州[Zheng4 zhou1]; 
客,[kè] customer; visitor; guest; 
小,[xiǎo] small; tiny; few; young; 
道,[dào] direction; way; road; path; CL:條|条[tiao2],股[gu3]; principle; truth; morality; reason; skill; method; Dao (of Daoism); to say; to speak; to talk; classifier for long thin things (rivers, cracks etc), barriers (walls, doors etc), questions (in an exam etc), commands, courses in a meal, steps in a process; province (of Korea or Japan); 
局,[jú] office; situation; classifier for games: match, set, round etc; 
展,[Zhǎn] surname Zhan; [zhǎn] to spread out; to open up; to exhibit; to put into effect; to postpone; to prolong; exhibition; 
峰,[fēng] (of a mountain) high and tapered peak or summit; mountain-like in appearance; highest level; classifier for camels; 
州,[zhōu] prefecture; (old) province; (old) administrative division; state (e.g. of US); oblast (Russia); canton (Switzerland); 
布,[bù] cloth; to declare; to announce; to spread; to make known; 
年,[Nián] surname Nian; [nián] year; CL:個|个[ge4]; 
广,[Guǎng] surname Guang; [guǎng] wide; numerous; to spread; 
运,[yùn] to move; to transport; to use; to apply; fortune; luck; fate; 
开,[kāi] to open; to start; to turn on; to boil; to write out (a prescription, check, invoice etc); to operate (vehicle); abbr. for 開爾文|开尔文 degrees Kelvin; 
较,[jiào] comparatively; (preposition comparing difference in degree); to contrast; to compare; rather; fairly; clearly (different); markedly; to haggle over; to quibble; also pr. [jiao3]; 
车,[Chē] surname Che; [chē] car; vehicle; CL:輛|辆[liang4]; machine; to shape with a lathe; [jū] war chariot (archaic); rook (in Chinese chess); rook (in chess); 
成,[Chéng] surname Cheng; [chéng] to succeed; to finish; to complete; to accomplish; to become; to turn into; to be all right; OK!; one tenth; 
路,[Lù] surname Lu; [lù] road; CL:條|条[tiao2]; journey; route; line (bus etc); sort; kind; 
支,[Zhī] surname Zhi; [zhī] to support; to sustain; to erect; to raise; branch; division; to draw money; classifier for rods such as pens and guns, for army divisions and for songs or compositions; 
足,[jù] excessive; [zú] foot; to be sufficient; ample; 
购,[gòu] to buy; to purchase; 
新,[Xīn] abbr. for Xinjiang 新疆[Xin1 jiang1] or Singapore 新加坡[Xin1 jia1 po1]; surname Xin; [xīn] new; newly; meso- (chemistry); 
证,[zhèng] to admonish; variant of 證|证[zheng4]; [zhèng] certificate; proof; to prove; to demonstrate; to confirm; variant of 症[zheng4]; 
旅,[lǔ:] trip; travel; to travel; brigade (army); 
要,[yāo] to demand; to request; to coerce; [yào] important; vital; to want; to ask for; will; going to (as future auxiliary); may; must; (used in a comparison) must be; probably; if; 
日,[Rì] abbr. for 日本[Ri4 ben3], Japan; [rì] sun; day; date, day of the month; 
时,[shí] old variant of 時|时[shi2]; [Shí] surname Shi; [shí] o'clock; time; when; hour; season; period; 
昌,[Chāng] surname Chang; [chāng] prosperous; flourishing; 
春,[Chūn] surname Chun; [chūn] spring (time); gay; joyful; youthful; love; lust; life; 
西,[Xī] the West; abbr. for Spain 西班牙[Xi1 ban1 ya2]; Spanish; [xī] west; 
昨,[zuó] yesterday; 
行,[háng] a row; series; age order (of brothers); profession; professional; relating to company; [xíng] to walk; to go; to travel; a visit; temporary; makeshift; current; in circulation; to do; to perform; capable; competent; effective; all right; OK!; will do; behavior; conduct; Taiwan pr. [xing4] for the behavior-conduct sense; 
期,[qī] a period of time; phase; stage; (used for issue of a periodical, courses of study); time; term; period; to hope; Taiwan pr. [qi2]; 
等,[děng] class; rank; grade; equal to; same as; to wait for; to await; et cetera; and so on; et al. (and other authors); after; as soon as; once; 
次,[cì] next in sequence; second; the second (day, time etc); secondary; vice-; sub-; infra-; inferior quality; substandard; order; sequence; hypo- (chemistry); classifier for enumerated events: time; 
武,[Wǔ] surname Wu; [wǔ] martial; military; 
站,[zhàn] station; to stand; to halt; to stop; branch of a company or organization; website; 
汉,[Hàn] Han ethnic group; Chinese (language); the Han dynasty (206 BC-220 AD); [hàn] man; 
海,[Hǎi] surname Hai; [hǎi] ocean; sea; CL:個|个[ge4],片[pian4]; great number of people or things; (dialect) numerous; 
满,[Mǎn] Manchu ethnic group; [mǎn] to fill; full; filled; packed; fully; completely; quite; to reach the limit; to satisfy; satisfied; contented; 
窗,[chuāng] shutter; window; CL:扇[shan4]; 
的,[de] of; ~'s (possessive particle); (used after an attribute); (used to form a nominal expression); (used at the end of a declarative sentence for emphasis); [dī] see 的士[di1 shi4]; [dí] really and truly; [dì] aim; clear; 
票,[piào] ticket; ballot; bank note; CL:張|张[zhang1]; person held for ransom; amateur performance of Chinese opera; classifier for shipments and business transactions (dialect); 
郑州,[Zhèng zhōu] Zhengzhou prefecture level city and capital of Henan Province in central China; 
满足,[mǎn zú] to satisfy; to meet (the needs of); satisfied; content; 
武汉,[Wǔ hàn] Wuhan city on Changjiang, subprovincial city and capital of Hubei province; 
期间,[qī jiān] period of time; time; time period; period; CL:個|个[ge4]; 
昨日,[zuó rì] yesterday; 
春运,[chūn yùn] (increased) passenger transportation around Chinese New Year; 
西安,[Xī ān] Xi'an, sub-provincial city and capital of Shaanxi 陝西省|陕西省[Shan3 xi1 Sheng3] in northwest China; see 西安區|西安区[Xi1 an1 qu1]; 
旅客,[lǔ: kè] traveler; tourist; 
业务,[yè wù] business; professional work; service; CL:項|项[xiang4]; 
上海,[Shàng hǎi] Shanghai municipality, central east China, abbr. to 滬|沪[Hu4]; 
支付,[zhī fù] to pay (money); 
成都,[Chéng dū] Chengdu subprovincial city and capital of Sichuan province 四川 in southwest China; 
开展,[kāi zhǎn] (begin to) develop; unfold; to start; to launch; to open; to carry out; 
车站,[chē zhàn] rail station; bus stop; CL:處|处[chu4],個|个[ge4]; 
开启,[kāi qǐ] to open; 
较大,[jiào dà] comparatively large; 
广场,[guǎng chǎng] public square; plaza; 
小时,[xiǎo shí] hour; CL:個|个[ge4]; 
实行,[shí xíng] to implement; to carry out; to put into practice; 
窗口,[chuāng kǒu] window; opening providing restricted access (e.g. customer service window); computer operating system window; fig. medium; intermediary; showpiece; testing ground; 
首次,[shǒu cì] first; first time; for the first time; 
召开,[zhào kāi] to convene (a conference or meeting); to convoke; to call together; 
南昌,[Nán chāng] Nanchang prefecture level city and capital of Jiangxi province 江西省 in southeast China; also Nanchang county; 
铁路,[tiě lù] railroad; railway; CL:條|条[tiao2]; 
之间,[zhī jiān] between; among; inter-; 
北京,[Běi jīng] Beijing, capital of People's Republic of China; Peking; PRC government; 
需要,[xū yào] to need; to want; to demand; to require; requirement; need; 
刷卡,[shuā kǎ] to use a credit card (or swipe card, smart card etc); 
间断,[jiàn duàn] disconnected; interrupted; suspended; 
全部,[quán bù] whole; entire; complete; 
保证,[bǎo zhèng] guarantee; to guarantee; to ensure; to safeguard; to pledge; CL:個|个[ge4]; 
集团,[jí tuán] group; bloc; corporation; conglomerate; 
今年,[jīn nián] this year; 
高峰,[gāo fēng] peak; summit; height; 
银行卡,[yín háng kǎ] bank card; ATM card; 
铁道部,[Tiě dào bù] Ministry of Railways (MOR), disbanded in 2013 with its regulatory functions taken over by the Ministry of Transport 交通運輸部|交通运输部[Jiao1 tong1 Yun4 shu1 bu4]; 
售票处,[shòu piào chù] ticket office; 
新闻发布会,[xīn wén fā bù huì] news conference; 
